Type,HowtoUse,Interactions,URL,Allergies,Review,Use,Drug,Indication,Precautions,AvoidUse,Sides,Condition
,"Take this medication by  mouth , usually once a day on an empty  stomach , 30 minutes to 1 hour before  breakfast , or as directed by your doctor. Dosage is based on your medical condition, laboratory test results, and response to treatment. For children, the dosage is also based on age. Your doctor will usually start you on a low dose and slowly increase your dose as needed. Use this medication regularly in order to get the most benefit from it. To help you remember, take it at the same time each day. Do not stop taking this medication without first consulting with your doctor. Thyroid replacement treatment is usually taken for life. Symptoms of  low thyroid  hormone levels include tiredness, muscle aches,  constipation ,  dry skin ,  weight  gain, slow heartbeat, or sensitivity to cold. Tell your doctor if your condition worsens or persists after several weeks of taking this medication.","Drug interactions may change how your medications work or increase your risk for serious side effects. This document does not contain all possible drug interactions. Keep a list of all the products you use (including prescription/nonprescription drugs and herbal products) and share it with your doctor and pharmacist. Do not start, stop, or change the dosage of any medicines without your doctor's approval. Some products that may interact with this drug include: androgens/anabolic steroids, beta blockers (e.g., propranolol), ""blood thinners"" (e.g., warfarin), corticosteroids (e.g., dexamethasone), cytokines (e.g., interferon-alpha, interleukin-2), digoxin, drugs affecting liver enzymes that remove liotrix from your body (such as phenobarbital, rifamycins including rifabutin, certain anti-seizure medicines including carbamazepine/phenytoin), drugs that can decrease thyroid hormone levels (e.g., amiodarone, medications containing iodide/iodine, lithium), estrogen-containing products (including birth control pills), growth hormones, medications for depression (e.g., maprotiline, tricyclic antidepressants such as amitriptyline, SSRIs such as sertraline). Certain medications (cholestyramine, colestipol, antacids, sucralfate, simethicone, iron, sodium polystyrene sulfonate, calcium carbonate, orlistat) can decrease the amount of liotrix that is absorbed by your body . If you are taking any of these drugs, separate them from this medication by at least 4 hours. Check the labels on all your medicines (e.g., cough-and-cold products, diet aids) because they may contain ingredients such as decongestants or caffeine that could increase your heart rate or blood pressure. Ask your pharmacist about using those products safely.",,,,"See also Warning section. Liotrix  is used to treat an underactive  thyroid  ( hypothyroidism ). It replaces or provides more of a certain natural substance ( thyroid  hormone) that is normally produced by the  thyroid  gland.  Low thyroid  hormone levels can occur naturally or when the thyroid gland is injured by  radiation /medications or removed by surgery. Having enough thyroid hormone in your bloodstream is important for maintaining normal mental and  physical activity . In children, having enough thyroid hormone is important for normal mental and physical development. This medication is also used to treat other types of  thyroid disorders  (e.g., certain types of goiters,  thyroid cancer ). This medication should not be used to treat  infertility  unless it is caused by  low thyroid  hormone levels.",,,"Before taking liotrix, tell your doctor or pharmacist if you are allergic to it; or if you have any other  . This product may contain inactive ingredients, which can cause allergic reactions or other problems. Talk to your pharmacist for more details. This medication should not be used if you have certain medical conditions. Before using this medicine, consult your doctor or pharmacist if you have: increased thyroid hormones (thyrotoxicosis), a   (acute myocardial infarction), adrenal gland problem (e.g., uncorrected adrenal insufficiency). Before using this medication, tell your doctor or pharmacist your medical history, especially of:   (e.g.,  , irregular heartbeat),  ,  , other hormone disorders (e.g., decreased pituitary hormone). If you have  , this medication may increase your  . Check your     regularly as directed by your doctor. Tell your doctor right away if you have symptoms of high blood sugar, such as increased thirst and urination. Your anti-diabetic medication or diet may need to be adjusted. Before having surgery, tell your doctor or dentist that you are taking this medication. Caution is advised when using this drug in the elderly because they may be more sensitive to the effects on the   caused by high thyroid hormone level. Current information shows that this drug may be used during  . Tell your doctor if you are pregnant or if you become pregnant because your dose may need to be adjusted. Small amounts of this medication pass into breast milk. Consult your doctor before breast-feeding.",,"Some  hair loss  may occur during the first few months of starting this drug. This effect is usually temporary as your body adjusts to this medication. If this effect persists or worsens, tell your doctor or pharmacist promptly. Remember that your doctor has prescribed this medication because he or she has judged that the benefit to you is greater than the risk of side effects. Many people using this medication do not have serious side effects. Tell your doctor right away if any of these unlikely but serious effects of high thyroid hormone levels occur:  diarrhea , bone pain,  headache , mental/mood changes (e.g., nervousness, mood swings), shaking (tremor), sensitivity to heat, increased  sweating , tiredness. Seek immediate medical attention if any of these rare but very serious effects of high thyroid hormone levels occur:  chest pain , fast/pounding/ irregular heartbeat ,  seizures , swelling of the  ankles /feet. A very serious  allergic reaction  to this drug is rare. However, seek immediate medical attention if you notice any symptoms of a serious  allergic reaction , including:  rash ,  itching /swelling (especially of the face/ tongue /throat), severe  dizziness ,  trouble breathing . This is not a complete list of possible side effects. If you notice other effects not listed above, contact your doctor or pharmacist. In the US - Call your doctor for medical advice about side effects. You may report side effects to FDA at 1-800-FDA-1088 or at www.fda.gov/medwatch. In Canada - Call your doctor for medical advice about side effects. You may report side effects to Health Canada at 1-866-234-2345. List liotrix side effects by likelihood and severity.           ",Additional Treatment for Thyroid Cancer
,"Read the Patient Information Leaflet if available from your pharmacist before you start receiving doxorubicin and each time you get an infusion. If you have any questions, ask your doctor or pharmacist. This medication is given by injection into a vein by a  health care  professional. The dosage is based on your medical condition, body size, and response to therapy. If this medication touches your skin, immediately and completely wash the skin with soap and water. If this medication gets in your  eye , open the eyelids and flush with plenty of water for 15 minutes. Seek immediate medical attention. Caregivers should take precautions (e.g., wear gloves) to prevent contact with the patient's urine or other body fluid for at least 5 days after treatment. Consult your pharmacist. Unless your doctor instructs you otherwise, drink plenty of cool fluids during treatment with this medication. This helps move the drug quickly through your body and helps reduce some of the side effects.","Drug interactions may change how your medications work or increase your risk for serious side effects. This document does not contain all possible drug interactions. Keep a list of all the products you use (including prescription/nonprescription drugs and herbal products) and share it with your doctor and pharmacist. Do not start, stop, or change the dosage of any medicines without your doctor's approval. Some products that may interact with this drug include: digoxin, progesterone, streptozocin, stavudine, trastuzumab, zidovudine. Other medications can affect the removal of doxorubicin from your body, which may affect how doxorubicin works. Examples include azole antifungals (such as ketoconazole), calcium channel blockers (e.g., verapamil, nifedipine), rifamycins (such as rifabutin), St. John's wort, drugs used to treat seizures (such as carbamazepine, phenytoin, phenobarbital), among others. Avoid eating foods or products containing turmeric (curcumin) while taking doxorubicin. It may decrease doxorubicin's effects. Consult your doctor or pharmacist for more details.",,,,Doxorubicin is an anthracycline type of  chemotherapy  that is used alone or with other treatments/medications to treat several different types of  cancer . Doxorubicin works by slowing or stopping the growth of  cancer  cells.,,,"Before using doxorubicin, tell your doctor or pharmacist if you are allergic to it; or to lincomycin; or if you have any other allergies. This product may contain inactive ingredients, which can cause allergic reactions or other problems. Talk to your pharmacist for more details. Before using this medication, tell your doctor or pharmacist your medical history, especially of: a current infection, low blood cell counts (e.g., anemia, neutropenia, thrombocytopenia), gout, heart problems (e.g., recent heart attack, heart failure, irregular heartbeat), a history of receiving any anthracycline-type drug (e.g., doxorubicin, idarubicin, daunorubicin, mitoxantrone), kidney problems, liver disease, severe mouth sores (stomatitis), radiation treatment (especially to the chest area). Do not have immunizations/vaccinations without the consent of your doctor, and avoid contact with people who have recently received oral polio vaccine. This medication may make you more sensitive to the sun. Avoid prolonged sun exposure, tanning booths, and sunlamps. Use a sunscreen and wear protective clothing when outdoors. To lower the chance of getting cut, bruised, or injured, use caution with sharp objects like safety razors and nail cutters, and avoid activities such as contact sports. Use a soft-bristle toothbrush to lower the risk of bleeding gums. Wash your hands well to prevent the spread of infections. Caution is advised when using this drug in children because they may be more sensitive to the effects of the drug, especially to radiation recall in the lungs, heart problems, or another cancer later on in life. Doxorubicin, in combination with other chemotherapies, may also slow the growth of children before puberty. This medication may lower sperm count or may cause abnormal sperm to form, possibly causing infertility or birth defects. Consult your doctor for more details. This medication can affect menstruation in females and cause premature menopause. Consult your doctor or pharmacist for details. This medication is not recommended for use during pregnancy. It may harm an unborn baby. It is recommended that men and women use effective forms of birth control (e.g., condoms and birth control pills) while being treated with this medication and for 6 months after stopping the medication. Consult your doctor for more details and to discuss reliable forms of birth control. This medication passes into breast milk. Because of the potential risk to the infant, breast-feeding while using this drug is not recommended. Consult your doctor before breast-feeding.",,"Nausea, vomiting,  diarrhea , and loss of appetite may occur.  Nausea and vomiting  can be severe. In some cases, drug therapy may be needed to prevent or relieve  nausea and vomiting . Not eating before your treatment may help relieve vomiting. Changes in diet and lifestyle, such as eating several small meals and limiting activity, may help lessen some of these effects. If any of these effects continue or worsen, notify your doctor or pharmacist. Doxorubicin may give a reddish color to your urine, tears, and sweat. This effect may start in the first hours after treatment and may last up to several days. This is a normal effect of the drug and should not be mistaken for  blood in your urine . Temporary  hair loss  may occur. Normal  hair  growth should return after treatment has ended. Nail changes (including fungal infections in the nail beds) may rarely occur. Remember that your doctor has prescribed this medication because he or she has judged that the benefit to you is greater than the risk of side effects. Many people using this medication do not have serious side effects. Tell your doctor right away if you have any serious side effects, including:  cough /hoarseness, persistent diarrhea, redness/flushing of face,  eye  redness/ itching , unusual tiredness,  joint pain , pain in the lower back/side/ stomach / abdomen , painful/difficult urination, stopped/missed menstrual periods, black/tarry stools, bloody mucus or discharge in stools, fast/ irregular heartbeat , shortness of breath,  dizziness , swelling of  ankles /feet, decreased urination. Painful sores on the lips,  mouth  and throat may occur. To decrease the risk, limit hot foods and drinks, brush your  teeth  carefully, avoid using mouthwash that contains alcohol, and rinse your  mouth  frequently with cool water. Get medical help right away if you have any very serious side effects, including:  chest pain . Within days to weeks after doxorubicin treatment, a serious skin reaction that looks likes a severe  sunburn  (radiation recall) may develop on any area of skin that has been previously treated with radiation. Tell your doctor right away if you develop skin redness, pain, tenderness, swelling, peeling, or  blisters . Your doctor may prescribe medication to help your skin heal faster and reduce the swelling. In addition, you should avoid prolonged sun exposure, tanning booths and sunlamps. Use a  sunscreen  and wear protective clothing when outdoors. In children, radiation recall may occur in the  lungs . Tell the doctor right away if you notice  wheezing  or  trouble breathing  in the child. A very serious  allergic reaction  to this drug is rare. However, get medical help right away if you notice any symptoms of a serious  allergic reaction , including: rash, itching/swelling (especially of the face/tongue/throat), severe dizziness, trouble breathing. This is not a complete list of possible side effects. If you notice other effects not listed above, contact your doctor or pharmacist. In the US - Call your doctor for medical advice about side effects. You may report side effects to FDA at 1-800-FDA-1088 or at www.fda.gov/medwatch. In Canada - Call your doctor for medical advice about side effects. You may report side effects to Health Canada at 1-866-234-2345. List doxorubicin intravenous side effects by likelihood and severity.           ",Additional Treatment for Thyroid Cancer
,"Take this medication by  mouth  as directed by your doctor, usually once daily on an empty  stomach , 30 minutes to 1 hour before  breakfast . Dosage is based on your medical condition, laboratory test results, and response to treatment. For children, the dosage is also based on age/ weight . Use this medication regularly in order to get the most benefit from it. To help you remember, take it at the same time each day. Do not stop taking this medication without first consulting with your doctor. Thyroid replacement treatment is usually taken for life. Certain medications ( cholestyramine ,  colestipol ,  colesevelam , antacids, sucralfate,  simethicone , iron, sodium polystyrene sulfonate,  calcium  carbonate,  orlistat ) can decrease the amount of thyroid hormone that is absorbed by your body. If you are taking any of these drugs, separate them from this medication by at least 4 hours. There are different brands of thyroid hormone available. Do not change brands without first consulting your doctor or pharmacist. Symptoms of  low thyroid  hormone levels include tiredness, muscle aches,  constipation ,  dry skin , weight gain, slow heartbeat, or sensitivity to cold. Tell your doctor if your condition worsens or persists after several weeks of taking this medication.","See also How to Use Section. Drug interactions may change how your medications work or increase your risk for serious side effects. This document does not contain all possible drug interactions. Keep a list of all the products you use (including prescription/nonprescription drugs and herbal products) and share it with your doctor and pharmacist. Do not start, stop, or change the dosage of any medicines without your doctor's approval. Some products that may interact with this drug include: ""blood thinners"" (such as warfarin), digoxin, estrogen-containing products (including birth control pills).",,,,"Thyroid  hormone is used to treat underactive  thyroid  ( hypothyroidism ). It is a natural product made from animal  thyroid  glands (usually a pig's). It replaces or provides more thyroid hormone, which is normally produced by the thyroid gland.  Low thyroid  hormone levels can occur naturally or when the thyroid gland is injured by  radiation /medications or removed by surgery. Having enough thyroid hormone is important for maintaining normal mental and  physical activity . In children, having enough thyroid hormone is important for normal mental and physical development. This medication is also used to treat other types of  thyroid disorders  (such as certain types of goiters,  thyroid cancer ) and also to test for thyroid function. This medication should not be used to treat  infertility  unless it is caused by  low thyroid  hormone levels. Older adults should discuss the risks and benefits of this medication with their doctor or pharmacist.",,,"Before taking thyroid hormone, tell your doctor or pharmacist if you are allergic to it; or to pork products; or if you have any other  . This product may contain inactive ingredients, which can cause allergic reactions or other problems. Talk to your pharmacist for more details. Before using this medication, tell your doctor or pharmacist your medical history, especially of: increased thyroid hormones (thyrotoxicosis), decreased adrenal gland function,   (such as  , irregular heartbeat),  ,  . Before having surgery, tell your doctor or dentist about all the products you use (including prescription drugs, nonprescription drugs, and herbal products). Older adults may be more sensitive to the side effects of this drug, especially chest pain, fast/pounding/irregular heartbeat. Current information shows that this drug may be used during  . Tell your doctor if you are pregnant because your dose may need to be adjusted. Thyroid hormone passes into breast milk but is unlikely to harm a nursing  . Consult your doctor before breast-feeding.",,"Hair loss  may occur during the first few months of treatment. This effect is usually temporary as your body adjusts to this medication. If this effect persists or worsens, tell your doctor or pharmacist promptly. Remember that your doctor has prescribed this medication because he or she has judged that the benefit to you is greater than the risk of side effects. Many people using this medication do not have serious side effects. Tell your doctor right away if any of these unlikely but serious effects of high thyroid hormone levels occur: increased  sweating , sensitivity to heat, mental/mood changes (such as nervousness, mood swings), tiredness,  diarrhea , shaking (tremor),  headache , shortness of breath. Get medical help right away if any of these rare but serious effects of high thyroid hormone levels occur:  chest pain , fast/pounding/ irregular heartbeat , swelling hands/ ankles /feet,  seizures . A very serious  allergic reaction  to this drug is rare. However, get medical help right away if you notice any symptoms of a serious  allergic reaction , including:  rash ,  itching /swelling (especially of the face/ tongue /throat), severe  dizziness ,  trouble breathing . This is not a complete list of possible side effects. If you notice other effects not listed above, contact your doctor or pharmacist. In the US - Call your doctor for medical advice about side effects. You may report side effects to FDA at 1-800-FDA-1088 or at www.fda.gov/medwatch. In Canada - Call your doctor for medical advice about side effects. You may report side effects to Health Canada at 1-866-234-2345. List thyroid (pork) side effects by likelihood and severity.           ",Additional Treatment for Thyroid Cancer
