Type,HowtoUse,Interactions,URL,Allergies,Review,Use,Drug,Indication,Precautions,AvoidUse,Sides,Condition
,"This  medication  is given by injection into a vein (intravenously-IV) or into a muscle (intramuscularly-IM) by a  healthcare  professional as directed by your doctor. If you are giving the injection yourself, learn all preparation and usage instructions from your  healthcare  professional. Follow all instructions for proper mixing and dilution with the correct IV fluids. Direct injections into the vein should be done slowly (over at least 10-15 minutes) to avoid the risk of  seizures . If you have questions regarding the use of this medication, consult your pharmacist. Before using this product, check it visually for particles or discoloration. If either is present, do not use this product. Learn how to store and discard needles and medical supplies safely. Consult your pharmacist for more details. The dosage is based on your medical condition, response to therapy, and  weight . Antibiotics  work best when the amount of medicine in your body is kept at a constant level. Therefore, inject this drug at evenly spaced intervals. Continue to use this medication until the full-prescribed amount is finished even if symptoms disappear after a few days. Stopping the medication too early may allow bacteria to continue to grow, which may result in a relapse of the infection. Inform your doctor if your condition persists or worsens.","Your   professionals (e.g., doctor or pharmacist) may already be aware of any possible   and may be monitoring you for it. Do not start, stop or change the dosage of any medicine before checking with them first. Before using this medication, tell your doctor or pharmacist of all prescription and nonprescription/herbal products you may use, especially of: live bacterial  ,  , tetracyclines,  . Although most antibiotics are unlikely to affect hormonal   such as pills, patch, or ring, a few antibiotics (such as rifampin, rifabutin) can decrease their effectiveness. This could result in pregnancy. If you use hormonal birth control, ask your doctor or pharmacist for more details. Ampicillin may cause false positive results with certain diabetic urine testing products (cupric sulfate-type). This drug may also affect the results of certain lab tests. Make sure laboratory personnel and your doctors know you use this drug. This document does not contain all possible interactions. Therefore, before using this product, tell your doctor or pharmacist of all the products you use. Keep a list of all your medications with you, and share the list with your doctor and pharmacist.",,,,"Ampicillin is used to treat a wide variety of  bacterial infections . It is a  penicillin -type antibiotic. It works by stopping the growth of bacteria. This antibiotic treats only bacterial infections. It will not work for viral infections (e.g.,  common cold ,  flu ). Unnecessary use or overuse of any antibiotic can lead to its decreased effectiveness.",,,"Before using ampicillin, tell your doctor or pharmacist if you are allergic to it; or to penicillin or cephalosporin  ; or if you have any other  . This product may contain inactive ingredients, which can cause allergic reactions or other problems. Talk to your pharmacist for more details. Before using this medication, tell your doctor or pharmacist your medical history, especially of:  , a certain type of viral infection ( ).  function declines as you grow older. This medication is removed by the  . Therefore, elderly people may be more sensitive to this drug. This medication should be used only when clearly needed during  . Discuss the risks and benefits with your doctor. Ampicillin passes into   milk. Consult your doctor before  -feeding.",,"Nausea ,  vomiting , or  diarrhea  may occur. If any of these effects persist or worsen, notify your doctor or pharmacist promptly. Remember that your doctor has prescribed this medication because he or she has judged that the benefit to you is greater than the risk of side effects. Many people using this medication do not have serious side effects. Tell your doctor right away if any of these rare but very serious side effects occur: dark urine, persistent nausea or vomiting,  stomach / abdominal pain , yellowing  eyes  or  skin , easy bruising or bleeding, persistent  sore throat  or fever. This medication may rarely cause a severe intestinal condition ( Clostridium difficile -associated diarrhea) due to a type of resistant bacteria. This condition may occur during treatment or weeks to months after treatment has stopped. Do not use anti-diarrhea products or narcotic pain medications if you have any of the following symptoms because these products may make them worse. Tell your doctor right away if you develop: persistent diarrhea, abdominal or stomach pain/cramping,  blood /mucus in your stool. Use of this medication for prolonged or repeated periods may result in oral  thrush  or a new  vaginal yeast infection  (oral or vaginal  fungal infection ). Contact your doctor if you notice white patches in your  mouth , a change in  vaginal discharge  or other new symptoms. A very serious  allergic reaction  to this drug is unlikely, but seek immediate medical attention if it occurs. Symptoms of a serious  allergic reaction  may include:  rash ,  itching /swelling (especially of the face/ tongue /throat), severe  dizziness ,  trouble breathing . Ampicillin can commonly cause a mild  rash  that is usually not serious. However, you may not be able to tell it apart from a rare rash that could be a sign of a  severe allergic reaction . Therefore, seek immediate medical attention if you develop any rash. This is not a complete list of possible side effects. If you notice other effects not listed above, contact your doctor or pharmacist. In the US - Call your doctor for medical advice about side effects. You may report side effects to FDA at 1-800-FDA-1088 or at www.fda.gov/medwatch. In Canada - Call your doctor for medical advice about side effects. You may report side effects to Health Canada at 1-866-234-2345. List ampicillin intravenous side effects by likelihood and severity.           ",Abdominal Pain and Frequent Stools with Blood & Mucous
,Consult your pharmacist.,"Consult your pharmacist. Keep a list of all your   with you, and share the list with your doctor and pharmacist.",,,,Consult your pharmacist.,,,Consult your pharmacist.,,Consult your pharmacist. In the US - Call your doctor for medical advice about side effects. You may report side effects to FDA at 1-800-FDA-1088 or at www.fda.gov/medwatch. In Canada - Call your doctor for medical advice about side effects. You may report side effects to Health Canada at 1-866-234-2345. List HyQvia IG Component subcutaneous side effects by likelihood and severity.           ,Absence of Gamma Globulins in the Blood
,"Depending on your specific product, this medication is given by injection into a vein or into a muscle. Use exactly as directed by your doctor. The dosage is based on your medical condition and response to therapy. For children, the dosage is also based on  weight . If you are giving this medication to yourself at home, learn all preparation and usage instructions from your  health care  professional. Before using, check this product visually for particles or discoloration. If either is present, do not use the liquid. Learn how to store and discard medical supplies safely. Give aminoglycosides (such as  gentamicin ) separately from this medication. Do not mix together in the same IV fluid. Antibiotics  work best when the amount of medicine in your body is kept at a constant level. Therefore, use this drug at evenly spaced intervals. Continue to use this medication until the full prescribed amount is finished, even if symptoms disappear after a few days. Stopping the medication too early may allow bacteria to continue to grow, which may result in a return of the infection. Tell your doctor if your condition persists or worsens."," may change how your medications work or increase your risk for serious side effects. This document does not contain all possible drug interactions. Keep a list of all the products you use (including prescription/nonprescription drugs and herbal products) and share it with your doctor and pharmacist. Do not start, stop, or change the dosage of any medicines without your doctor's approval. Some products that may interact with this drug include: ""blood thinners"" (e.g., warfarin), live bacterial vaccines, methotrexate, NSAIDS (e.g., aspirin, indomethacin), tetracyclines. Low-dose aspirin should be continued if prescribed by your doctor for specific medical reasons such as heart attack or stroke prevention (usually at dosages of 81-325 milligrams per day). Ask your doctor or pharmacist for more details. Although most antibiotics are unlikely to affect hormonal birth control such as pills, patch, or ring, a few antibiotics (such as rifampin, rifabutin) can decrease their effectiveness. This could result in pregnancy. If you use hormonal birth control, ask your doctor or pharmacist for more details. This medication may interfere with certain laboratory tests (including certain urine glucose tests), possibly causing false test results. Make sure laboratory personnel and all your doctors know you use this drug.",,,,This  medication  is used to treat a wide variety of  bacterial infections . It is also used to prevent infection of the  heart  (bacterial endocarditis) in patients with certain  heart  diseases who are having surgery. This medication is known as a natural  penicillin  antibiotic. It works by stopping the growth of bacteria.,,,"Before using this medication, tell your doctor or pharmacist if you are allergic to it; or to penicillin or cephalosporin  ; or if you have any other  . This product may contain inactive ingredients (such as corn for products containing dextrose), which can cause allergic reactions or other problems. Talk to your pharmacist for more details. Before using this medication, tell your doctor or pharmacist your medical history, especially of:  ,  . Certain products of this medication contain sodium. Consult your doctor or pharmacist if you are on a salt-restricted diet or if you have a condition that could be worsened by an increase in salt intake (e.g.,  ). Certain products of this medication contain  . Consult your doctor or pharmacist if you are taking potassium  , salt substitutes containing potassium, or medications that can increase potassium (e.g.,   such as  ), or if you have a   level (hyperkalemia). Kidney function declines as you grow older. This medication is removed by the  . Therefore, elderly people may be at greater risk for side effects while using this drug. Kidney function is not fully developed in newborns and infants. This medication is removed by the kidneys. Therefore, newborns and infants may be at greater risk for side effects while using this drug. During  , this medication should be used only when clearly needed. Discuss the risks and benefits with your doctor. This drug passes into   milk. Consult your doctor before  -feeding.",,"Pain/redness/swelling at injection site may occur. If any of these effects persist or worsen, tell your doctor or pharmacist promptly. Remember that your doctor has prescribed this medication because he or she has judged that the benefit to you is greater than the risk of side effects. Many people using this medication do not have serious side effects. Tell your doctor right away if you have any serious side effects, including: joint/ muscle pain , muscle  weakness , swelling of  ankles /feet, dark/cloudy urine, extreme tiredness, fast/slow/ irregular heartbeat , new signs of infection (e.g., fever, persistent  sore throat ), easy bruising/bleeding, signs of  kidney  problems (such as change in the amount of urine), numbness/tingling of arms/legs,  seizures , uncontrolled movements, confusion. If used to treat  syphilis  or other spirochetal infections (e.g.,  Lyme disease ), this medication may cause a condition known as Jarisch-Herxheimer reaction. This condition may occur 1 to 2 hours after you receive the medication and can last up to 24 hours. Notify your doctor right away if you experience any of these symptoms: fever/chills, muscle pain, worsening of  skin  sores, fast heartbeat, fast breathing,  dizziness , flushing. This medication may rarely cause a severe intestinal condition ( Clostridium difficile -associated  diarrhea ) due to a type of resistant bacteria. This condition may occur weeks to months after treatment has stopped. Do not use anti-diarrhea products or narcotic pain medications if you have any of these symptoms because these products may make them worse. Tell your doctor right away if you develop: persistent diarrhea, abdominal or  stomach pain /cramping,  blood /mucus in your stool. Use of this medication for prolonged or repeated periods may result in oral  thrush  or a new  vaginal yeast infection . Contact your doctor if you notice white patches in your  mouth , a change in  vaginal discharge , or other new symptoms. A very serious  allergic reaction  to this drug is rare. However, get medical help right away if you notice any symptoms of a serious  allergic reaction , including:  rash ,  itching /swelling (especially of the face/ tongue /throat), severe dizziness,  trouble breathing . This is not a complete list of possible side effects. If you notice other effects not listed above, contact your doctor or pharmacist. In the US - Call your doctor for medical advice about side effects. You may report side effects to FDA at 1-800-FDA-1088 or at www.fda.gov/medwatch. In Canada - Call your doctor for medical advice about side effects. You may report side effects to Health Canada at 1-866-234-2345. List penicillin G potassium injection side effects by likelihood and severity.           ",Abdominal Infection due to the Bacteria Actinomyces
,"Depending on your specific product, this medication is given by injection into a vein or into a muscle. Use exactly as directed by your doctor. The dosage is based on your medical condition and response to therapy. For children, the dosage is also based on  weight . If you are giving this medication to yourself at home, learn all preparation and usage instructions from your  health care  professional. Before using, check this product visually for particles or discoloration. If either is present, do not use the liquid. Learn how to store and discard medical supplies safely. Give aminoglycosides (such as  gentamicin ) separately from this medication. Do not mix together in the same IV fluid. Antibiotics  work best when the amount of medicine in your body is kept at a constant level. Therefore, use this drug at evenly spaced intervals. Continue to use this medication until the full prescribed amount is finished, even if symptoms disappear after a few days. Stopping the medication too early may allow bacteria to continue to grow, which may result in a return of the infection. Tell your doctor if your condition persists or worsens."," may change how your medications work or increase your risk for serious side effects. This document does not contain all possible drug interactions. Keep a list of all the products you use (including prescription/nonprescription drugs and herbal products) and share it with your doctor and pharmacist. Do not start, stop, or change the dosage of any medicines without your doctor's approval. Some products that may interact with this drug include: ""blood thinners"" (e.g., warfarin), live bacterial vaccines, methotrexate, NSAIDS (e.g., aspirin, indomethacin), tetracyclines. Low-dose aspirin should be continued if prescribed by your doctor for specific medical reasons such as heart attack or stroke prevention (usually at dosages of 81-325 milligrams per day). Ask your doctor or pharmacist for more details. Although most antibiotics are unlikely to affect hormonal birth control such as pills, patch, or ring, a few antibiotics (such as rifampin, rifabutin) can decrease their effectiveness. This could result in pregnancy. If you use hormonal birth control, ask your doctor or pharmacist for more details. This medication may interfere with certain laboratory tests (including certain urine glucose tests), possibly causing false test results. Make sure laboratory personnel and all your doctors know you use this drug.",,,,This  medication  is used to treat a wide variety of  bacterial infections . It is also used to prevent infection of the  heart  (bacterial endocarditis) in patients with certain  heart  diseases who are having surgery. This medication is known as a natural  penicillin  antibiotic. It works by stopping the growth of bacteria.,,,"Before using this medication, tell your doctor or pharmacist if you are allergic to it; or to penicillin or cephalosporin  ; or if you have any other  . This product may contain inactive ingredients (such as corn for products containing dextrose), which can cause allergic reactions or other problems. Talk to your pharmacist for more details. Before using this medication, tell your doctor or pharmacist your medical history, especially of:  ,  . Certain products of this medication contain sodium. Consult your doctor or pharmacist if you are on a salt-restricted diet or if you have a condition that could be worsened by an increase in salt intake (e.g.,  ). Certain products of this medication contain  . Consult your doctor or pharmacist if you are taking potassium  , salt substitutes containing potassium, or medications that can increase potassium (e.g.,   such as  ), or if you have a   level (hyperkalemia). Kidney function declines as you grow older. This medication is removed by the  . Therefore, elderly people may be at greater risk for side effects while using this drug. Kidney function is not fully developed in newborns and infants. This medication is removed by the kidneys. Therefore, newborns and infants may be at greater risk for side effects while using this drug. During  , this medication should be used only when clearly needed. Discuss the risks and benefits with your doctor. This drug passes into   milk. Consult your doctor before  -feeding.",,"Pain/redness/swelling at injection site may occur. If any of these effects persist or worsen, tell your doctor or pharmacist promptly. Remember that your doctor has prescribed this medication because he or she has judged that the benefit to you is greater than the risk of side effects. Many people using this medication do not have serious side effects. Tell your doctor right away if you have any serious side effects, including: joint/ muscle pain , muscle  weakness , swelling of  ankles /feet, dark/cloudy urine, extreme tiredness, fast/slow/ irregular heartbeat , new signs of infection (e.g., fever, persistent  sore throat ), easy bruising/bleeding, signs of  kidney  problems (such as change in the amount of urine), numbness/tingling of arms/legs,  seizures , uncontrolled movements, confusion. If used to treat  syphilis  or other spirochetal infections (e.g.,  Lyme disease ), this medication may cause a condition known as Jarisch-Herxheimer reaction. This condition may occur 1 to 2 hours after you receive the medication and can last up to 24 hours. Notify your doctor right away if you experience any of these symptoms: fever/chills, muscle pain, worsening of  skin  sores, fast heartbeat, fast breathing,  dizziness , flushing. This medication may rarely cause a severe intestinal condition ( Clostridium difficile -associated  diarrhea ) due to a type of resistant bacteria. This condition may occur weeks to months after treatment has stopped. Do not use anti-diarrhea products or narcotic pain medications if you have any of these symptoms because these products may make them worse. Tell your doctor right away if you develop: persistent diarrhea, abdominal or  stomach pain /cramping,  blood /mucus in your stool. Use of this medication for prolonged or repeated periods may result in oral  thrush  or a new  vaginal yeast infection . Contact your doctor if you notice white patches in your  mouth , a change in  vaginal discharge , or other new symptoms. A very serious  allergic reaction  to this drug is rare. However, get medical help right away if you notice any symptoms of a serious  allergic reaction , including:  rash ,  itching /swelling (especially of the face/ tongue /throat), severe dizziness,  trouble breathing . This is not a complete list of possible side effects. If you notice other effects not listed above, contact your doctor or pharmacist. In the US - Call your doctor for medical advice about side effects. You may report side effects to FDA at 1-800-FDA-1088 or at www.fda.gov/medwatch. In Canada - Call your doctor for medical advice about side effects. You may report side effects to Health Canada at 1-866-234-2345. List penicillin G pot in dextrose intravenous side effects by likelihood and severity.           ",Abdominal Infection due to the Bacteria Actinomyces
,Consult your pharmacist.,"Consult your pharmacist. Keep a list of all your   with you, and share the list with your doctor and pharmacist.",,,,Consult your pharmacist.,,,Consult your pharmacist.,,Consult your pharmacist. In the US - Call your doctor for medical advice about side effects. You may report side effects to FDA at 1-800-FDA-1088 or at www.fda.gov/medwatch. In Canada - Call your doctor for medical advice about side effects. You may report side effects to Health Canada at 1-866-234-2345. List RiaSTAP intravenous side effects by likelihood and severity.           ,Absence of Fibrinogen in the Plasma
