Type,HowtoUse,Interactions,URL,Allergies,Review,Use,Drug,Indication,Precautions,AvoidUse,Sides,Condition
,"Read the Medication Guide provided by your pharmacist before you start using  olanzapine  and each time you get a refill. If you have any questions, ask your doctor or pharmacist. This medication is given by a slow, intramuscular injection (IM) by a  healthcare  professional. The dosage is based on your medical condition and response to therapy. This medication is intended for short-term control of acute agitation symptoms. If you require continuous treatment for your condition, your doctor may switch you to an oral medication.","Drug interactions may change how your medications work or increase your risk for serious side effects. This document does not contain all possible drug interactions. Keep a list of all the products you use (including prescription/nonprescription drugs and herbal products) and share it with your doctor and pharmacist. Do not start, stop, or change the dosage of any medicines without your doctor's approval. A product that may interact with this drug is: metoclopramide. Tell your doctor or pharmacist if you are taking other products that cause drowsiness including alcohol, antihistamines (such as cetirizine, diphenhydramine), drugs for sleep or anxiety (such as alprazolam, diazepam, zolpidem), muscle relaxants, and narcotic pain relievers (such as codeine). Check the labels on all your medicines (e.g., cough-and-cold products) because they may contain ingredients that cause drowsiness. Ask your pharmacist about the safe use of those products.",,,,"This medication is used to treat severe agitation associated with certain mental/mood conditions ( schizophrenia ,  bipolar mania ). It works by helping to restore the balance of certain natural chemicals in the  brain  (neurotransmitters). Talk to the doctor about the risks and benefits of treatment (especially when used in teenagers). See also Precautions section.",,,"Before using olanzapine, tell your doctor or pharmacist if you are allergic to it; or if you have any other allergies. This product may contain inactive ingredients, which can cause allergic reactions or other problems. Talk to your pharmacist for more details. Before using this medication, tell your doctor or pharmacist your medical history, especially of: liver problems, dementia, seizures, prostate problems, glaucoma (narrow angle type), intestinal disease, difficulty swallowing, smoking, low white blood cell count, personal or family history of diabetes, heart disease, high cholesterol/triglyceride levels. This drug may make you dizzy or drowsy. Do not drive, use machinery, or do any activity that requires alertness until you are sure you can perform such activities safely. Avoid alcoholic beverages. This medication may make you sweat less, making you more likely to get heat stroke. Avoid doing things that may cause you to overheat, such as hard work or exercise in hot weather, or using hot tubs. When the weather is hot, drink a lot of fluids and dress lightly. If you overheat, quickly look for a place to cool down and rest. Get medical help right away if you have a fever that does not go away, mental/mood changes, headache, or dizziness. Teenagers may be more sensitive to the side effects of this drug, especially weight gain, and also increased amounts of cholesterol, triglycerides and prolactin. See also Side Effects section for more details. Older adults may be more sensitive to the side effects of this drug, especially drowsiness, constipation, trouble urinating, confusion, or dizziness upon standing. Drowsiness, confusion, and dizziness can increase the risk of falling. During pregnancy, this medication should be used only when clearly needed. Babies born to mothers who have used this drug during the last 3 months of pregnancy may rarely develop symptoms including muscle stiffness or shakiness, drowsiness, feeding/breathing difficulties, or constant crying. If you notice any of these symptoms in your newborn especially during their first month, tell the doctor right away. Since untreated mental/mood problems (such as schizophrenia, bipolar mania) can be a serious condition, do not stop taking this medication unless directed by your doctor. If you are planning pregnancy, become pregnant, or think you may be pregnant, immediately discuss with your doctor the benefits and risks of using this medication during pregnancy. This drug passes into breast milk and may have undesirable effects on a nursing infant. Consult your doctor before breast-feeding.",,"Dry mouth ,  constipation ,  nausea ,  dizziness , lightheadedness,  stomach pain ,  weight  gain, drowsiness,  back pain , or redness/pain/swelling at the injection site may occur. If any of these effects persist or worsen, notify your doctor or pharmacist promptly. To reduce the risk of dizziness and lightheadedness, get up slowly when rising from a sitting or lying position. Remember that your doctor has prescribed this medication because he or she has judged that the benefit to you is greater than the risk of side effects. Many people using this medication do not have serious side effects. Tell your doctor right away if you have any serious side effects, including: agitation, confusion, slow heartbeat, restlessness,  weakness , numbness or tingling of hands or feet, tremor, yellowing of the  eyes  or  skin , severe  stomach /abdominal pain, difficulty swallowing, trouble urinating. Get medical help right away if you have any very serious side effects, including:  seizures . This drug may rarely make your  blood sugar  level rise, which can cause or worsen  diabetes . High  blood sugar  can rarely cause serious conditions such as  diabetic coma . Tell your doctor right away if you develop symptoms of high blood sugar, such as unusual increased thirst and urination. If you already have  diabetes , be sure to check your  blood  sugars regularly. This drug may also cause significant weight gain and a rise in your  blood   cholesterol  (or  triglyceride ) levels, especially in teenagers. These effects, along with diabetes, may increase your risk for developing  heart disease . Discuss the risks and benefits of treatment with your doctor. (See also Notes section.) This medication may rarely cause a very serious condition called  neuroleptic malignant syndrome  (NMS). Get medical help right away if you have any of the following symptoms: fever, muscle stiffness/pain/tenderness/weakness, severe tiredness, severe confusion,  sweating , fast/irregular heartbeat, dark urine, signs of  kidney  problems (such as change in the amount of urine). Olanzapine may rarely cause a condition known as  tardive dyskinesia . In some cases, this condition may be permanent. Tell your doctor right away if you develop any unusual/uncontrolled movements (especially of the face or  tongue ). In rare instances, this medication may increase your blood level of a certain hormone ( prolactin ). For females, this rare increase in prolactin levels may result in unwanted  breast  milk, the menstrual period stopping, or difficulty becoming  pregnant . For males, it may result in decreased sexual ability, inability to produce  sperm , or enlarged  breasts . If you develop any of these symptoms, tell your doctor right away. A very serious  allergic reaction  to this drug is rare. However, get medical help right away if you notice any symptoms of a serious  allergic reaction , including: fever,  swollen lymph nodes , rash,  itching /swelling (especially of the face/ tongue /throat), severe dizziness,  trouble breathing . This is not a complete list of possible side effects. If you notice other effects not listed above, contact your doctor or pharmacist. In the US - Call your doctor for medical advice about side effects. You may report side effects to FDA at 1-800-FDA-1088 or at www.fda.gov/medwatch. In Canada - Call your doctor for medical advice about side effects. You may report side effects to Health Canada at 1-866-234-2345. List Zyprexa intramuscular side effects by likelihood and severity.           ",Agitation associated with Bipolar Mania
,"Read the Medication Guide and Instructions for Use provided by your pharmacist before you start using methoxy polyethylene glycol-epoetin beta and each time you get a refill. If you have any questions, ask your doctor or pharmacist. Inject this medication into a vein or under the  skin  as directed by your doctor, usually every 2 to 4 weeks. Hemodialysis patients should receive this medication by injection into a vein. If you are using this medication at home, learn all preparation and usage instructions from your  health care  professional and the product package. Do not shake the medication and do not mix it with other medications. Before using, check this product visually for particles or discoloration. If either is present, do not use the liquid. Before injecting each dose, clean the injection site with rubbing alcohol. If you are injecting methoxy polyethylene glycol-epoetin beta under the skin, change the injection site each time to lessen injury under the skin. Learn how to store and discard medical supplies safely. The dosage is based on your medical condition,  weight , and response to treatment. Blood tests should be done often to check how well this medication is working and to decide the correct dose for you. Consult your doctor for more details. Use this medication regularly to get the most benefit from it. To help you remember, it may help to mark your calendar with a reminder. Do not increase your dose or use this drug more often or for longer than prescribed. Your condition will not improve any faster, and your risk of side effects will increase. It may take 2 to 6 weeks before your red blood cell count increases. Tell your doctor if your symptoms do not get better or if they get worse.","Drug interactions may change how your medications work or increase your risk for serious side effects. This document does not contain all possible drug interactions. Keep a list of all the products you use (including prescription/nonprescription drugs and herbal products) and share it with your doctor and pharmacist. Do not start, stop, or change the dosage of any medicines without your doctor's approval.",,,,This medication is used to treat anemia (low red blood cell count) in people with long-term serious  kidney disease  ( chronic kidney disease ). It works by signaling the bone marrow to make more red  blood cells . Methoxy polyethylene glycol-epoetin beta helps to reverse anemia. It also helps to reduce the need for blood transfusions. This medication is very similar to the natural substance in your body (erythropoietin) that prevents anemia.,,,"Before using methoxy polyethylene glycol-epoetin beta, tell your doctor or pharmacist if you are allergic to it; or to other drugs that cause more red blood cells to be made (such as  ,   alfa); or if you have any other allergies. This product may contain inactive ingredients, which can cause allergic reactions or other problems. Talk to your pharmacist for more details. Before using this medication, tell your doctor or pharmacist your medical history, especially of: high blood pressure, heart disease (such as heart failure, past heart attack/stroke), seizure disorder, severe anemia caused by antibodies to past erythropoietin-type treatment (pure red cell aplasia). Before having surgery, tell your doctor or dentist about all the products you use (including prescription drugs, nonprescription drugs, and herbal products). During pregnancy, this medication should be used only when clearly needed. Discuss the risks and benefits with your doctor. It is unknown if this medication passes into breast milk. Consult your doctor before breast-feeding.",,"Headache , body aches,  diarrhea , or  vomiting  may occur. If any of these effects last or get worse, tell your doctor or pharmacist promptly. Remember that your doctor has prescribed this medication because he or she has judged that the benefit to you is greater than the risk of side effects. Many people using this medication do not have serious side effects. Methoxy polyethylene glycol-epoetin beta may sometimes cause or worsen  high blood pressure , especially in patients with long-term  kidney failure . This effect may be caused by the number of red blood cells increasing too quickly, usually within the first 3 months of starting treatment. If you have  high blood pressure , it should be well controlled before beginning treatment with this medication. Your  blood pressure  should be checked often. Ask your doctor if you should learn how to check your own blood pressure. If  high blood pressure  develops or worsens, follow your doctor's instructions about diet changes and starting or adjusting your  high blood pressure  medication. Lowering high blood pressure helps prevent strokes,  heart attacks , and further  kidney  problems. Keep all lab appointments to have your red blood cell count/hemoglobin level tested regularly to reduce the chance of this side effect. Rarely, this medication may suddenly stop working well after a period of time because your body may make antibodies to it. A very serious anemia can result. Tell your doctor right away if  symptoms of anemia  return (such as increased tiredness, low energy, pale skin color, shortness of breath). Get medical help right away if you have any very serious side effects, including:  seizures . This medication may rarely cause serious (sometimes fatal) problems from blood clots (such as  heart attack ,  stroke , blood clots in the legs or  lungs ). Get medical help right away if you have: shortness of breath/rapid breathing, chest/jaw/left arm pain, unusual  sweating , confusion, sudden  dizziness / fainting , pain/swelling/warmth in the groin/ calf , sudden/severe  headaches , trouble speaking,  weakness  on one side of the body, sudden  vision  changes, blood clots in your hemodialysis vascular access site. A very serious  allergic reaction  to this drug is rare. However, get medical help right away if you notice any symptoms of a serious  allergic reaction , including:  rash ,  itching /swelling (especially of the face/ tongue /throat), severe dizziness,  trouble breathing , fast heartbeat. This is not a complete list of possible side effects. If you notice other effects not listed above, contact your doctor or pharmacist. In the US - Call your doctor for medical advice about side effects. You may report side effects to FDA at 1-800-FDA-1088 or at www.fda.gov/medwatch. In Canada - Call your doctor for medical advice about side effects. You may report side effects to Health Canada at 1-866-234-2345. List Mircera injection side effects by likelihood and severity.           ",Anemia in Non-Dialysis-Dependent Chronic Kidney Disease
,"Read the Patient Information Leaflet if available from your pharmacist before you start using ferumoxytol and each time you get a refill. If you have any questions, ask your doctor or pharmacist. Ferumoxytol is given by a  health care  professional. It is given by slow injection into a vein over at least 15 minutes, usually in a clinic or hospital. Treatment involves receiving two doses of ferumoxytol, given 3 to 8 days apart. It may be given during dialysis. The dosage is based on your medical condition and response to treatment. Your doctor will take blood tests to monitor your response to treatment."," may change how your medications work or increase your risk for serious side effects. This document does not contain all possible  . Keep a list of all the products you use (including prescription/nonprescription drugs and herbal products) and share it with your doctor and pharmacist. Do not start, stop, or change the dosage of any medicines without your doctor's approval. Some products that may interact with this drug include: other iron products.",,,,"This medicine is used to treat ""iron-poor""  blood  ( anemia ) in people with long-term  kidney disease . It is a form of iron that must be given by injection. You may need extra iron because of  blood  loss during  kidney dialysis  treatment. Iron is an important part of your red blood cells and is needed to carry oxygen throughout the body. Many patients with kidney disease cannot get enough iron from food and require injections.",,,"Before taking ferumoxytol, tell your doctor or pharmacist if you are allergic to it; or if you have had a reaction to other types of injectable iron; or if you have any other  . This product may contain inactive ingredients, which can cause allergic reactions or other problems. Talk to your pharmacist for more details. Before using this medication, tell your doctor or pharmacist your medical history. This drug may make you dizzy. Do not drive, use machinery, or do any activity that requires alertness until you are sure you can perform such activities safely. Limit   beverages. During use and for 3 months after your last injection, tell X-ray staff that you use or used this medication. This medication can interfere with the results of an   scan. Before having surgery, tell your doctor or dentist about all the products you use (including prescription drugs, nonprescription drugs, and herbal products). Older adults that have a serious   or dizziness while using this drug may have more severe symptoms. During  , this medication should be used only when clearly needed. Discuss the risks and benefits with your doctor. It is unknown if this drug passes into   milk. Consult your doctor before  -feeding.",,"See also Warning section. Dizziness or fainting ( hypotension ) may occur. Pain, swelling, or redness at the injection site may also occur. If any of these effects persist or worsen, tell your doctor or pharmacist promptly. To reduce the risk of dizziness or fainting, get up slowly when rising from a sitting or lying position. Remember that your doctor has prescribed this medication because he or she has judged that the benefit to you is greater than the risk of side effects. Many people using this medication do not have serious side effects. Tell your doctor right away if any of these unlikely but serious side effects occur: unusual bruising,  skin  darkens (bronze tone), swelling of hands/feet/lower legs,  chest pain . This is not a complete list of possible side effects. If you notice other effects not listed above, contact your doctor or pharmacist. In the US - Call your doctor for medical advice about side effects. You may report side effects to FDA at 1-800-FDA-1088 or at www.fda.gov/medwatch. In Canada - Call your doctor for medical advice about side effects. You may report side effects to Health Canada at 1-866-234-2345. List ferumoxytol intravenous side effects by likelihood and severity.           ",Anemia in Non-Dialysis-Dependent Chronic Kidney Disease
,"Read the Medication Guide and Patient Information Leaflet provided by your pharmacist before you start using this medication and each time you get a refill. If you have any questions, ask your doctor or pharmacist. This medication is given as an injection under the  skin  or into a vein as directed by your doctor. Hemodialysis patients should receive this medication by injection into a vein. If you are using this medication at home, learn all preparation and usage instructions from your  health care  professional. Do not shake this medication and do not mix it with other drugs or IV solutions. Before using, check this product visually for particles or discoloration. If either is present, do not use the liquid. If you are injecting this medication under the skin, before each dose, clean the injection site with rubbing alcohol. Change the injection site each time to lessen injury under the skin. Learn how to store and discard medical supplies safely. The dosage is based on your medical condition,  weight , and response to treatment. Blood tests should be done often to check how well this medication is working and to decide the correct dose for you. Consult your doctor for more details. Use this medication regularly to get the most benefit from it. To help you remember, use it on the same day of the week as directed. Do not increase your dose or use this drug more often or for longer than prescribed. Your condition will not improve any faster, and your risk of side effects will increase. It may take 2 to 6 weeks before your red blood cell count increases. Tell your doctor if your symptoms do not get better or if they get worse.","Drug interactions may change how your medications work or increase your risk for serious side effects. This document does not contain all possible drug interactions. Keep a list of all the products you use (including prescription/nonprescription drugs and herbal products) and share it with your doctor and pharmacist. Do not start, stop, or change the dosage of any medicines without your doctor's approval.",,,,This medication is used to treat  anemia  (low red blood cell count) in people with long-term serious  kidney disease  (chronic  kidney failure ) and people receiving  chemotherapy  for some types of  cancer  ( cancer  that does not involve the bone marrow or  blood cells ). Darbepoetin alfa also helps to reduce the need for blood transfusions. It works by signaling the bone marrow to make more red blood cells. This medication is very similar to the natural substance in your body (erythropoietin) that prevents anemia.,,,"Before using darbepoetin alfa, tell your doctor or pharmacist if you are allergic to it; or to other drugs that cause more red blood cells to be made (such as epoetin alfa); or if you have any other allergies. This product may contain inactive ingredients (such as polysorbate, latex), which can cause allergic reactions or other problems. Talk to your pharmacist for more details. Before using this medication, tell your doctor or pharmacist your medical history, especially of: high blood pressure, heart disease (such as heart failure, past heart attack/stroke), seizure disorder, severe anemia caused by antibodies to past erythropoietin-type treatment (pure red cell aplasia). Before having surgery, tell your doctor or dentist about all the products you use (including prescription drugs, nonprescription drugs, and herbal products). During pregnancy, this medication should be used only when clearly needed. Discuss the risks and benefits with your doctor. It is unknown if this medication passes into breast milk. Consult your doctor before breast-feeding.",,"Headache , body aches,  diarrhea ,  cough ,  stomach / abdominal pain , or injection site pain may occur. If any of these effects last or get worse, tell your doctor or pharmacist promptly. Remember that your doctor has prescribed this medication because he or she has judged that the benefit to you is greater than the risk of side effects. Many people using this medication do not have serious side effects. Darbepoetin alfa may sometimes cause or worsen  high blood pressure , especially in patients with long-term kidney failure. This effect may be caused by the number of red blood cells increasing too quickly, usually within the first 3 months of starting treatment. If you have  high blood pressure , it should be well controlled before beginning treatment with this medication. Your  blood pressure  should be checked often. Ask your doctor if you should learn how to check your own blood pressure. If  high blood pressure  develops or worsens, follow your doctor's instructions about diet changes and starting or adjusting your  high blood pressure  medication. Lowering high blood pressure helps prevent strokes,  heart attacks , and further  kidney  problems. Keep all lab appointments to have your red blood cell count/hemoglobin level tested regularly to reduce the chance of this side effect. Rarely, this medication may suddenly stop working well after a period of time because your body may make antibodies to it. A very serious anemia can result. Tell your doctor right away if  symptoms of anemia  return (such as increased tiredness, low energy, pale skin color, shortness of breath). Tell your doctor right away if you have any serious side effects, including: swelling hands/ ankles /feet. Get medical help right away if you have any very serious side effects, including:  seizures . This medication may rarely cause serious (sometimes fatal) problems from blood clots (such as  heart attack ,  stroke , blood clots in the legs or  lungs ). Get medical help right away if you have: shortness of breath/rapid breathing, chest/jaw/left arm pain, unusual  sweating , confusion, sudden  dizziness / fainting , pain/swelling/warmth in the groin/ calf , sudden/severe  headaches , trouble speaking,  weakness  on one side of the body, sudden  vision  changes, blood clots in your hemodialysis vascular access site. A very serious  allergic reaction  to this drug is rare. However, get medical help right away if you notice any symptoms of a serious  allergic reaction , including: rash, itching/swelling (especially of the face/tongue/throat), severe dizziness,  trouble breathing . This is not a complete list of possible side effects. If you notice other effects not listed above, contact your doctor or pharmacist. In the US - Call your doctor for medical advice about side effects. You may report side effects to FDA at 1-800-FDA-1088 or at www.fda.gov/medwatch. In Canada - Call your doctor for medical advice about side effects. You may report side effects to Health Canada at 1-866-234-2345. List darbepoetin alfa in polysorbate injection side effects by likelihood and severity.           ",Anemia in Non-Dialysis-Dependent Chronic Kidney Disease
